name,version,license,license_url,functionality,notes,dist_name,channel,build,build_number
aiohappyeyeballs,2.4.0,PSF-2.0,https://github.com/aio-libs/aiohappyeyeballs/blob/main/LICENSE,Helps connects using Happy Eyeballs with pre-resolved addrinfo,,aiohappyeyeballs-2.4.0-pyhd8ed1ab_0,conda-forge,pyhd8ed1ab_0,0
boto3,1.17.0,Apache-2.0,https://github.com/boto/boto3/blob/develop/LICENSE,Amazon Web Services SDK for Python,,boto3-1.17.0-pyhd8ed1ab_0,conda-forge,pyhd8ed1ab_0,0
botocore,1.20.0,Apache-2.0,https://github.com/boto/botocore/blob/develop/LICENSE.txt,Low-level data driven core of boto3,,botocore-1.20.0-pyhd8ed1ab_0,conda-forge,pyhd8ed1ab_0,0
bottle,0.12.23,MIT,https://bottlepy.org/docs/dev/,a fast simple and lightweight WSGI micro web-framework for Python,,bottle-0.12.23-pyhd8ed1ab_0,conda-forge,pyhd8ed1ab_0,0
brotli-python,1.1.0,MIT,https://github.com/google/brotli?tab=MIT-1-ov-file#readme,Brotli compression format,,brotli-python-1.1.0-py39hfa9831e_2,conda-forge,py39hfa9831e_2,2
bzip2,1.0.8,bzip2-1.0.6,https://gitlab.com/bzip2/bzip2/-/blob/master/COPYING,high quality data compressor,,bzip2-1.0.8-h99b78c6_7,conda-forge,h99b78c6_7,7
c-ares,1.33.1,MIT,https://github.com/c-ares/c-ares?tab=MIT-1-ov-file#readme,c-ares is a C library for asynchronous DNS requests (including name resolves),,c-ares-1.33.1-hd74edd7_0,conda-forge,hd74edd7_0,0
ca-certificates,2024.8.30,ISC,https://github.com/conda-forge/ca-certificates-feedstock,Certificates for use with other packages,,ca-certificates-2024.8.30-hf0a4a13_0,conda-forge,hf0a4a13_0,0
certifi,2024.8.30,ISC,https://github.com/certifi/python-certifi/blob/master/LICENSE,Mozilla’s collection of Root Certificates for validating the trustworthiness of SSL certificates while verifying the identity of TLS hosts,,certifi-2024.8.30-pyhd8ed1ab_0,conda-forge,pyhd8ed1ab_0,0
chardet,3.0.4,LGPL-2.1-only,https://github.com/chardet/chardet?tab=LGPL-2.1-1-ov-file#readme,Universal character encoding detector,,chardet-3.0.4-py39h0caf4da_1008,conda-forge,py39h0caf4da_1008,1008
coloredlogs,15.0.1,MIT,https://github.com/xolox/python-coloredlogs/blob/master/LICENSE.txt,Enables colored terminal output for Python's logging module,,coloredlogs-15.0.1-pyhd8ed1ab_3,conda-forge,pyhd8ed1ab_3,3
cpuonly,2.0,,https://anaconda.org/pytorch/cpuonly,meta package for selecting cpu only variant of pytorch,,cpuonly-2.0-0,pytorch,0,0
datasets,2.21.0,Apache-2.0,https://github.com/huggingface/datasets?tab=Apache-2.0-1-ov-file#readme,HuggingFace/Datasets is an open library of NLP datasets.,,datasets-2.21.0-pyhd8ed1ab_0,conda-forge,pyhd8ed1ab_0,0
dill,0.3.8,BSD-3-Clause,https://github.com/uqfoundation/dill?tab=License-1-ov-file#readme,serialize all of python,,dill-0.3.8-pyhd8ed1ab_0,conda-forge,pyhd8ed1ab_0,0
fastdtw,0.3.4,MIT,https://github.com/slaypni/fastdtw?tab=MIT-1-ov-file#readme,Dynamic Time Warping (DTW) algorithm with an O(N) time and memory complexity,,fastdtw-0.3.4-py39h766bdb0_4,conda-forge,py39h766bdb0_4,4
filelock,3.16.0,Unlicense,https://github.com/tox-dev/py-filelock/blob/main/LICENSE,A platform independent file lock,,filelock-3.16.0-pyhd8ed1ab_0,conda-forge,pyhd8ed1ab_0,0
frozenlist,1.4.1,Apache-2.0,https://github.com/aio-libs/frozenlist?tab=Apache-2.0-1-ov-file#readme,A list-like structure which implements collections.abc.MutableSequence,,frozenlist-1.4.1-py39h06df861_1,conda-forge,py39h06df861_1,1
fsspec,2024.5.0,BSD-3-Clause,https://github.com/fsspec/filesystem_spec/blob/master/LICENSE,A specification for pythonic filesystems,,fsspec-2024.5.0-pyhff2d567_0,conda-forge,pyhff2d567_0,0
future,0.18.3,MIT,https://github.com/PythonCharmers/python-future,Missing compatibility layer between Python 2 and Python 3,,future-0.18.3-pyhd8ed1ab_0,conda-forge,pyhd8ed1ab_0,0
gflags,2.2.2,BSD-3-Clause,https://github.com/gflags/gflags?tab=BSD-3-Clause-1-ov-file#readme,A C++ library that implements commandline flags processing,,gflags-2.2.2-hc88da5d_1004,conda-forge,hc88da5d_1004,1004
glog,0.7.1,BSD-3-Clause,https://github.com/google/glog,C++ implementation of the Google logging module,,glog-0.7.1-heb240a5_0,conda-forge,heb240a5_0,0
gmp,6.3.0,GPL-2.0-or-later OR LGPL-3.0-or-later,https://github.com/ncw/gmp/blob/master/LICENSE,The GNU multiprecision library,,gmp-6.3.0-h7bae524_2,conda-forge,h7bae524_2,2
gmpy2,2.1.5,LGPL-3.0-or-later,https://github.com/aleaxit/gmpy/blob/master/COPYING.LESSER,GMP/MPIR, MPFR,gmpy2-2.1.5-py39h0bbb021_2,conda-forge,py39h0bbb021_2,2
huggingface_hub,0.24.6,Apache-2.0,https://github.com/huggingface/huggingface_hub/blob/main/LICENSE,dependency of transformers library,,huggingface_hub-0.24.6-pyhd8ed1ab_0,conda-forge,pyhd8ed1ab_0,0
humanfriendly,10.0,MIT,https://github.com/xolox/python-humanfriendly/blob/master/LICENSE.txt,Human friendly output for text interfaces using Python,,humanfriendly-10.0-pyhd8ed1ab_6,conda-forge,pyhd8ed1ab_6,6
idna,3.8,BSD-3-Clause,https://github.com/kjd/idna,Internationalized Domain Names in Applications (IDNA),,idna-3.8-pyhd8ed1ab_0,conda-forge,pyhd8ed1ab_0,0
jinja2,3.1.4,BSD-3-Clause,https://github.com/pallets/jinja/,Jinja is a fast, expressive,jinja2-3.1.4-pyhd8ed1ab_0,conda-forge,pyhd8ed1ab_0,0
jmespath,0.10.0,MIT,https://github.com/jmespath/jmespath.py,Allows you to declaratively specify how to extract elements from a JSON document,,jmespath-0.10.0-pyh9f0ad1d_0,conda-forge,pyh9f0ad1d_0,0
joblib,1.4.2,BSD-3-Clause,https://github.com/joblib/joblib/blob/master/LICENSE.txt,Python function as pipeline jobs,,joblib-1.4.2-pyhd8ed1ab_0,conda-forge,pyhd8ed1ab_0,0
libabseil,20240116.2,Apache-2.0,https://github.com/abseil/abseil-cpp?tab=Apache-2.0-1-ov-file,The repository contains the Abseil C++ library code,,libabseil-20240116.2-cxx17_h00cdb27_1,conda-forge,cxx17_h00cdb27_1,1
libblas,3.9.0,BSD-3-Clause,http://www.netlib.org/blas/#_licensing,Linear Algebra PACKage,,libblas-3.9.0-20_osxarm64_openblas,conda-forge,20_osxarm64_openblas,20
libbrotlicommon,1.1.0,MIT,https://github.com/google/brotli?tab=MIT-1-ov-file#readme,Brotli compression format,,libbrotlicommon-1.1.0-hd74edd7_2,conda-forge,hd74edd7_2,2
libbrotlidec,1.1.0,MIT,,Brotli compression format,,libbrotlidec-1.1.0-hd74edd7_2,conda-forge,hd74edd7_2,2
libbrotlienc,1.1.0,MIT,https://github.com/google/brotli?tab=MIT-1-ov-file#readme,Brotli compression format,,libbrotlienc-1.1.0-hd74edd7_2,conda-forge,hd74edd7_2,2
libcblas,3.9.0,BSD-3-Clause,http://www.netlib.org/blas/#_licensing,Linear Algebra PACKage,,libcblas-3.9.0-20_osxarm64_openblas,conda-forge,20_osxarm64_openblas,20
libcrc32c,1.1.2,BSD-3-Clause,https://github.com/google/crc32c?tab=BSD-3-Clause-1-ov-file#readme,CRC32C implementation with support for CPU-specific acceleration instructions,,libcrc32c-1.1.2-hbdafb3b_0,conda-forge,hbdafb3b_0,0
libcurl,8.9.1,curl,https://github.com/curl/curl?tab=License-1-ov-file#readme,tool and library for transferring data with URL syntax,,libcurl-8.9.1-hfd8ffcc_0,conda-forge,hfd8ffcc_0,0
libcxx,18.1.8,Apache-2.0 WITH LLVM-exception,https://llvm.org/docs/DeveloperPolicy.html#license,LLVM C++ standard library,,libcxx-18.1.8-h3ed4263_7,conda-forge,h3ed4263_7,7
libedit,3.1.20191231,BSD-2-Clause,http://thrysoee.dk/editline|http://www.netbsd.org/about/redistribution.html,Command line editor library provides generic line editing, history,libedit-3.1.20191231-hc8eb9b7_2,conda-forge,hc8eb9b7_2,2
libev,4.33,BSD-2-Clause,http://software.schmorp.de/pkg/libev.html,A full-featured and high-performance event loop that is loosely modeled after libevent, but without its limitations and bugs.,libev-4.33-h93a5062_2,conda-forge,h93a5062_2,2
libevent,2.1.12,BSD-3-Clause,https://github.com/libevent/libevent?tab=License-1-ov-file#readme,An event notification library,,libevent-2.1.12-h2757513_1,conda-forge,h2757513_1,1
libffi,3.4.2,MIT,https://github.com/libffi/libffi/blob/master/LICENSE,A Portable Foreign Function Interface Library,,libffi-3.4.2-h3422bc3_5,conda-forge,h3422bc3_5,5
libgfortran,5.0.0,GPL-3.0-only WITH GCC-exception-3.1,http://www.gnu.org/licenses/gpl|https://www.gnu.org/licenses/gcc-exception-3.1.en.html,Fortran runtime library,,libgfortran-5.0.0-13_2_0_hd922786_3,conda-forge,13_2_0_hd922786_3,3
libgfortran5,13.2.0,GPL-3.0-only WITH GCC-exception-3.1,http://www.gnu.org/licenses/gpl|https://www.gnu.org/licenses/gcc-exception-3.1.en.html,Fortran runtime library,,libgfortran5-13.2.0-hf226fd6_3,conda-forge,hf226fd6_3,3
liblapack,3.9.0,BSD-3-Clause,https://netlib.org/lapack/LICENSE.txt,Linear Algebra PACKage,,liblapack-3.9.0-20_osxarm64_openblas,conda-forge,20_osxarm64_openblas,20
libllvm11,11.1.0,Apache-2.0 WITH LLVM-exception,https://github.com/llvm-mirror/llvm?tab=License-1-ov-file#readme,Development headers and libraries for LLVM,,libllvm11-11.1.0-hfa12f05_5,conda-forge,hfa12f05_5,5
libnghttp2,1.58.0,MIT,https://github.com/nghttp2/nghttp2/blob/master/COPYING,This is an implementation of Hypertext Transfer Protocol version 2,,libnghttp2-1.58.0-ha4dd798_1,conda-forge,ha4dd798_1,1
libopenblas,0.3.25,BSD-3-Clause,https://github.com/xianyi/OpenBLAS/blob/develop/LICENSE,An optimized BLAS library based on GotoBLAS2 1.13 BSD version,,libopenblas-0.3.25-openmp_h6c19121_0,conda-forge,openmp_h6c19121_0,0
libparquet,17.0.0,Apache-2.0,https://github.com/apache/arrow?tab=Apache-2.0-1-ov-file#readme,C++ libraries for Apache Parquet,,libparquet-17.0.0-hf0ba9ef_13_cpu,conda-forge,hf0ba9ef_13_cpu,13
libprotobuf,4.25.3,BSD-3-Clause,https://github.com/protocolbuffers/protobuf/blob/main/LICENSE,Google's data interchange format. C++ Libraries and protoc, the protobuf compiler,libprotobuf-4.25.3-hbfab5d5_0,conda-forge,hbfab5d5_0,0
libre2-11,2023.09.01,BSD-3-Clause,https://github.com/google/re2/?tab=BSD-3-Clause-1-ov-file#readme,alternative to backtracking regular expression engines like those used in PCRE Perl and Python,,libre2-11-2023.09.01-h7b2c953_2,conda-forge,h7b2c953_2,2
libssh2,1.11.0,BSD-3-Clause,https://github.com/libssh2/libssh2?tab=BSD-3-Clause-1-ov-file#readme,a library implementing the SSH2 protocol,,libssh2-1.11.0-h7a5bd25_0,conda-forge,h7a5bd25_0,0
libthrift,0.20.0,Apache-2.0,https://github.com/apache/thrift?tab=Apache-2.0-1-ov-file#readme,Compiler and C++ libraries and headers for the Apache Thrift RPC system,,libthrift-0.20.0-h64651cc_1,conda-forge,h64651cc_1,1
libutf8proc,2.8.0,MIT,https://github.com/JuliaStrings/utf8proc?tab=License-1-ov-file#readme,a clean C library for processing UTF-8 Unicode data,,libutf8proc-2.8.0-h1a8c8d9_0,conda-forge,h1a8c8d9_0,0
libxml2,2.12.7,MIT,https://gitlab.gnome.org/GNOME/libxml2/,The XML C parser and toolkit of Gnome,,libxml2-2.12.7-h01dff8b_4,conda-forge,h01dff8b_4,4
libzlib,1.3.1,Zlib,http://zlib.net/zlib_license.html,compression library,dependency of python,libzlib-1.3.1-hfb2fe0b_1,conda-forge,hfb2fe0b_1,1
llvm-openmp,18.1.8,Apache-2.0 WITH LLVM-exception,https://llvm.org/docs/DeveloperPolicy.html#license,LLVM openmp runtime,,llvm-openmp-18.1.8-hde57baf_1,conda-forge,hde57baf_1,1
llvmlite,0.39.1,BSD-2-Clause,https://github.com/numba/llvmlite/blob/main/LICENSE,A lightweight LLVM python binding for writing JIT compilers,,llvmlite-0.39.1-py39h8ca5d33_1,conda-forge,py39h8ca5d33_1,1
lz4-c,1.9.4,BSD-2-Clause,https://github.com/lz4/lz4?tab=License-1-ov-file#readme,Extremely Fast Compression algorithm,,lz4-c-1.9.4-hb7217d7_0,conda-forge,hb7217d7_0,0
markupsafe,2.1.5,BSD-3-Clause,https://github.com/pallets/markupsafe,Safely add untrusted strings to HTML/XML markup.,,markupsafe-2.1.5-py39h06df861_1,conda-forge,py39h06df861_1,1
mpc,1.3.1,LGPL-3.0-or-later,https://gitlab.inria.fr/mpc/mpc/-/blob/master/COPYING.LESSER,GNU C library for arithmetic of complex numbers with arbitrarily high precision and correct rounding,,mpc-1.3.1-h8f1351a_1,conda-forge,h8f1351a_1,1
mpfr,4.2.1,LGPL-3.0-only,https://gitlab.inria.fr/mpfr/mpfr/-/blob/master/COPYING,a C library for multiple-precision floating-point computations with correct rounding,,mpfr-4.2.1-hb693164_3,conda-forge,hb693164_3,3
mpmath,1.3.0,BSD-3-Clause,https://github.com/mpmath/mpmath/blob/master/LICENSE,A Python library for arbitrary-precision floating-point arithmetic,,mpmath-1.3.0-pyhd8ed1ab_0,conda-forge,pyhd8ed1ab_0,0
multidict,6.1.0,Apache-2.0,https://github.com/aio-libs/multidict?tab=License-1-ov-file#readme,multidict implementation,,multidict-6.1.0-py39ha5f49b9_0,conda-forge,py39ha5f49b9_0,0
multiprocess,0.70.16,BSD-3-Clause,https://github.com/uqfoundation/multiprocess,better multiprocessing and multithreading in python,,multiprocess-0.70.16-py39h06df861_1,conda-forge,py39h06df861_1,1
ncurses,6.5,X11 AND BSD-3-Clause,https://invisible-island.net/ncurses/ncurses-license.html,Library for text-based user interfaces,,ncurses-6.5-h7bae524_1,conda-forge,h7bae524_1,1
networkx,3.0,BSD-3-Clause,https://github.com/networkx/networkx/blob/master/LICENSE.txt,Python package for creating and manipulating complex networks,,networkx-3.0-pyhd8ed1ab_0,conda-forge,pyhd8ed1ab_0,0
numba,0.56.4,BSD-2-Clause,https://github.com/numba/numba?tab=BSD-2-Clause-1-ov-file#readme,NumPy aware dynamic Python compiler using LLVM,,numba-0.56.4-py39h9954f2d_1,conda-forge,py39h9954f2d_1,1
numpy,1.23.0,BSD-3-Clause,https://github.com/numpy/numpy/blob/master/LICENSE.txt,The fundamental package for scientific computing with Python,,numpy-1.23.0-py39h7df2422_0,conda-forge,py39h7df2422_0,0
onnx,1.16.0,Apache-2.0,https://github.com/onnx/onnx/blob/main/LICENSE,Open Neural Network Exchange library,,onnx-1.16.0-py39h2ed0be7_1,conda-forge,py39h2ed0be7_1,1
onnxruntime,1.18.1,MIT AND BSL-1.0,https://github.com/microsoft/onnxruntime/blob/master/LICENSE,cross-platform, high performance ML inferencing and training accelerator,onnxruntime-1.18.1-py39h5f5751a_1_cpu,conda-forge,py39h5f5751a_1_cpu,1
openssl,3.3.2,Apache-2.0,https://github.com/openssl/openssl/blob/master/LICENSE.txt,ssl library,,openssl-3.3.2-h8359307_0,conda-forge,h8359307_0,0
orc,2.0.2,Apache-2.0,https://github.com/apache/orc/blob/main/LICENSE,C++ libraries for Apache ORC,,orc-2.0.2-h75dedd0_0,conda-forge,h75dedd0_0,0
packaging,24.1,Apache-2.0,https://github.com/pypa/packaging/blob/main/LICENSE|https://github.com/pypa/packaging/blob/main/LICENSE.APACHE|https://github.com/pypa/packaging/blob/main/LICENSE.BSD,Core utilities for Python packages,,packaging-24.1-pyhd8ed1ab_0,conda-forge,pyhd8ed1ab_0,0
pandas,1.1.5,BSD-3-Clause,https://github.com/pandas-dev/pandas/blob/master/LICENSE,data structures and data analysis tools,,pandas-1.1.5-py39ha4bedbf_0,conda-forge,py39ha4bedbf_0,0
patsy,0.5.6,BSD-2-Clause AND PSF-2.0,https://github.com/pydata/patsy/blob/master/LICENSE.txt,library for describing statistical models and building design matrices,,patsy-0.5.6-pyhd8ed1ab_0,conda-forge,pyhd8ed1ab_0,0
platformdirs,4.3.2,MIT,https://github.com/platformdirs/platformdirs?tab=MIT-1-ov-file#readme,a tool to help you choose an appropriate directory name,,platformdirs-4.3.2-pyhd8ed1ab_0,conda-forge,pyhd8ed1ab_0,0
pooch,1.8.2,BSD-3-Clause,https://github.com/fatiando/pooch,A friend to fetch your data files,,pooch-1.8.2-pyhd8ed1ab_0,conda-forge,pyhd8ed1ab_0,0
protobuf,4.25.3,BSD-3-Clause,https://github.com/protocolbuffers/protobuf/blob/main/LICENSE,Google's data interchange format,,protobuf-4.25.3-py39hd6078d7_1,conda-forge,py39hd6078d7_1,1
psutil,5.8.0,BSD-3-Clause,https://github.com/giampaolo/psutil/blob/master/LICENSE,process manipuation,,psutil-5.8.0-py39h5161555_2,conda-forge,py39h5161555_2,2
pydantic,1.10.13,MIT,https://github.com/samuelcolvin/pydantic/blob/master/LICENSE,Data validation and settings management,,pydantic-1.10.13-py39h17cfd9d_1,conda-forge,py39h17cfd9d_1,1
python,3.9.19,Python-2.0,https://docs.python.org/3/license.html,python runtime,,python-3.9.19-hd7ebdb9_0_cpython,conda-forge,hd7ebdb9_0_cpython,0
python-dateutil,2.9.0,Apache-2.0,https://github.com/dateutil/dateutil/blob/master/LICENSE,Extensions to the standard Python datetime module,,python-dateutil-2.9.0-pyhd8ed1ab_0,conda-forge,pyhd8ed1ab_0,0
python-flatbuffers,24.3.25,Apache-2.0,https://github.com/google/flatbuffers/blob/master/LICENSE.txt,library for use with the Flatbuffers serialization format,,python-flatbuffers-24.3.25-pyh59ac667_0,conda-forge,pyh59ac667_0,0
python-xxhash,3.5.0,BSD-2-Clause,https://github.com/ifduyue/python-xxhash?tab=BSD-2-Clause-1-ov-file#readme,Python binding for xxHash,,python-xxhash-3.5.0-py39h06df861_1,conda-forge,py39h06df861_1,1
python_abi,3.9,BSD-3-Clause,https://github.com/conda-forge/python_abi-feedstock/blob/main/LICENSE.txt,Meta package to select python implementation,,python_abi-3.9-5_cp39,conda-forge,5_cp39,5
pytorch,2.2.2,BSD 3-Clause,https://github.com/pytorch/pytorch/blob/master/LICENSE,deep learning library,,pytorch-2.2.2-py3.9_0,pytorch,py3.9_0,0
pytorch-mutex,1.0,,https://anaconda.org/pytorch/pytorch-mutex,Meta package to select the PyTorch variant,,pytorch-mutex-1.0-cpu,pytorch,cpu,0
pytz,2024.1,MIT,https://github.com/newvem/pytz/blob/master/LICENSE.txt,dependency,,pytz-2024.1-pyhd8ed1ab_0,conda-forge,pyhd8ed1ab_0,0
pyyaml,6.0.2,MIT,https://github.com/yaml/pyyaml/blob/master/LICENSE,YAML parser,,pyyaml-6.0.2-py39h06df861_1,conda-forge,py39h06df861_1,1
re2,2023.09.01,BSD-3-Clause,https://github.com/google/re2/blob/main/LICENSE,regular expression library,,re2-2023.09.01-h4cba328_2,conda-forge,h4cba328_2,2
regex,2024.7.24,Python-2.0,https://bitbucket.org/mrabarnett/mrab-regex/src/hg/LICENSE.txt,regular expression library,,regex-2024.7.24-py39h06df861_1,conda-forge,py39h06df861_1,1
requests,2.32.3,Apache-2.0,https://github.com/psf/requests/blob/main/LICENSE,HTTP Library for Python,,requests-2.32.3-pyhd8ed1ab_0,conda-forge,pyhd8ed1ab_0,0
ruptures,1.1.9,BSD-2-Clause,https://github.com/deepcharles/ruptures,Python library for off-line change point detection,,ruptures-1.1.9-py39h161d348_2,conda-forge,py39h161d348_2,2
s3transfer,0.3.7,Apache-2.0,https://github.com/boto/s3transfer,An Amazon S3 transfer manager,,s3transfer-0.3.7-pyhd8ed1ab_0,conda-forge,pyhd8ed1ab_0,0
safetensors,0.4.5,Apache-2.0,https://github.com/huggingface/safetensors?tab=Apache-2.0-1-ov-file#readme,Fast and Safe Tensor serialization,,safetensors-0.4.5-py39h9c3e640_0,conda-forge,py39h9c3e640_0,0
scikit-learn,1.5.1,BSD-3-Clause,https://github.com/scikit-learn/scikit-learn/blob/master/COPYING,machine learning library,,scikit-learn-1.5.1-py39h3c33c8b_0,conda-forge,py39h3c33c8b_0,0
scipy,1.10.0,BSD-3-Clause,https://github.com/scipy/scipy/blob/master/LICENSE.txt,math libraries and data science tools,,scipy-1.10.0-py39h18313fe_2,conda-forge,py39h18313fe_2,2
six,1.16.0,MIT,https://github.com/benjaminp/six/blob/master/LICENSE,backwards compatibility utility package,,six-1.16.0-pyh6c4a22f_0,conda-forge,pyh6c4a22f_0,0
snappy,1.2.1,BSD-3-Clause,https://github.com/golang/snappy/blob/master/LICENSE,A fast compressor/decompressor,,snappy-1.2.1-hd02b534_0,conda-forge,hd02b534_0,0
statsmodels,0.13.2,BSD-3-Clause,https://github.com/statsmodels/statsmodels/blob/master/LICENSE.txt,statistics and math library package,,statsmodels-0.13.2-py39h7b9fbcb_0,conda-forge,py39h7b9fbcb_0,0
stumpy,1.12.0,BSD-3-Clause,https://github.com/TDAmeritrade/stumpy?tab=License-1-ov-file#readme,a python library that computes something called a matrix profile, which can then be used for a variety of time series data mining tasks,stumpy-1.12.0-pyhd8ed1ab_0,conda-forge,pyhd8ed1ab_0,0
sympy,1.13.2,BSD-3-Clause,https://github.com/sympy/sympy/blob/master/LICENSE,Python Library for Symbolic Mathematics,,sympy-1.13.2-pypyh2585a3b_103,conda-forge,pypyh2585a3b_103,103
tbb,2021.5.0,Apache-2.0,https://github.com/oneapi-src/oneTBB/blob/master/LICENSE.txt,threading library,,tbb-2021.5.0-hffc8910_5,conda-forge,hffc8910_5,5
threadpoolctl,3.5.0,BSD-3-Clause,https://github.com/joblib/threadpoolctl/blob/master/LICENSE,Python helpers to control the threadpools of native libraries,,threadpoolctl-3.5.0-pyhc1e730c_0,conda-forge,pyhc1e730c_0,0
tokenizers,0.15.2,Apache-2.0,https://github.com/huggingface/tokenizers/blob/main/LICENSE,tokenizers for machine learning,,tokenizers-0.15.2-py39heb7857c_0,conda-forge,py39heb7857c_0,0
tqdm,4.66.5,MPL-2.0 or MIT,https://github.com/tqdm/tqdm/blob/master/LICENCE,Progress Meter Library,,tqdm-4.66.5-pyhd8ed1ab_0,conda-forge,pyhd8ed1ab_0,0
transformers,4.38.1,Apache-2.0,https://github.com/huggingface/transformers/blob/main/LICENSE,Natural Language Processing library,,transformers-4.38.1-pyhd8ed1ab_0,conda-forge,pyhd8ed1ab_0,0
typing-extensions,4.12.2,PSF-2.0,https://github.com/python/typing/blob/master/typing_extensions/LICENSE,type hinting library for python,,typing-extensions-4.12.2-hd8ed1ab_0,conda-forge,hd8ed1ab_0,0
typing_extensions,4.12.2,PSF-2.0,https://github.com/python/typing/blob/master/typing_extensions/LICENSE,Type Hints for Python,,typing_extensions-4.12.2-pyha770c72_0,conda-forge,pyha770c72_0,0
tzdata,2024a,LicenseRef-Public-Domain,https://github.com/eggert/tz?tab=License-1-ov-file#readme,The Time Zone Database (called tz, tzdb or zoneinfo) data,tzdata-2024a-h8827d51_1,conda-forge,h8827d51_1,1
urllib3,1.26.19,MIT,https://github.com/urllib3/urllib3/blob/main/LICENSE.txt,HTTP library with thread-safe connection pooling file post,,urllib3-1.26.19-pyhd8ed1ab_0,conda-forge,pyhd8ed1ab_0,0
watchdog,2.1.7,Apache-2.0,https://github.com/gorakhargosh/watchdog/blob/master/LICENSE,python library for monitor file system events,,watchdog-2.1.7-py39hb18efdd_1,conda-forge,py39hb18efdd_1,1
wheel,0.44.0,MIT,https://github.com/pypa/wheel/blob/master/LICENSE.txt,package distribution,,wheel-0.44.0-pyhd8ed1ab_0,conda-forge,pyhd8ed1ab_0,0
xxhash,0.8.2,BSD-2-Clause,https://github.com/Cyan4973/xxHash?tab=License-1-ov-file#readme,extremely fast hash algorithm,,xxhash-0.8.2-hb547adb_0,conda-forge,hb547adb_0,0
xz,5.2.6,LGPL-2.1 and GPL-2.0,https://git.tukaani.org/?p=xz.git;a=blob_plain;f=COPYING;hb=HEAD,Data compression software with high compression ratio,,xz-5.2.6-h57fd34a_0,conda-forge,h57fd34a_0,0
yaml,0.2.5,MIT,https://github.com/yaml/libyaml/blob/master/License,A C library for parsing yaml,,yaml-0.2.5-h3422bc3_2,conda-forge,h3422bc3_2,2
yarl,1.11.1,Apache-2.0,https://github.com/aio-libs/yarl/blob/master/LICENSE,URL library,,yarl-1.11.1-py39h06df861_0,conda-forge,py39h06df861_0,0
zstd,1.5.6,BSD-3-Clause,https://github.com/facebook/zstd,lossless compression algorithm,,zstd-1.5.6-hb46c0d2_0,conda-forge,hb46c0d2_0,0
