name,version,license,license_url,functionality,notes,dist_name,channel,build,build_number
boto3,1.17.0,Apache-2.0,https://github.com/boto/boto3/blob/develop/LICENSE,Amazon Web Services SDK for Python,,boto3-1.17.0-pyhd8ed1ab_0,conda-forge,pyhd8ed1ab_0,0
botocore,1.20.0,Apache-2.0,https://github.com/boto/botocore/blob/develop/LICENSE.txt,Low-level data-driven core of boto 3,,botocore-1.20.0-pyhd8ed1ab_0,conda-forge,pyhd8ed1ab_0,0
bottle,0.12.23,MIT,https://bottlepy.org/docs/dev/,a fast simple and lightweight WSGI micro web-framework for Python,,bottle-0.12.23-pyhd8ed1ab_0,conda-forge,pyhd8ed1ab_0,0
brotli-python,1.1.0,MIT,https://github.com/google/brotli?tab=MIT-1-ov-file#readme,Brotli compression format,,brotli-python-1.1.0-py38h940360d_1,conda-forge,py38h940360d_1,1
bzip2,1.0.8,bzip2-1.0.6,,,,bzip2-1.0.8-hfdf4475_7,conda-forge,hfdf4475_7,7
ca-certificates,2024.7.4,ISC,https://github.com/conda-forge/ca-certificates-feedstock,Certificates for use with other packages,,ca-certificates-2024.7.4-h8857fd0_0,conda-forge,h8857fd0_0,0
certifi,2024.7.4,ISC,https://github.com/certifi/python-certifi/blob/master/LICENSE,Mozilla’s collection of Root Certificates for validating the trustworthiness of SSL certificates while verifying the identity of TLS hosts,,certifi-2024.7.4-pyhd8ed1ab_0,conda-forge,pyhd8ed1ab_0,0
chardet,3.0.4,LGPL-2.1-only,https://github.com/chardet/chardet?tab=LGPL-2.1-1-ov-file#readme,Universal character encoding detector,,chardet-3.0.4-py38h5347e94_1008,conda-forge,py38h5347e94_1008,1008
coloredlogs,15.0.1,MIT,https://github.com/xolox/python-coloredlogs/blob/master/LICENSE.txt,Enables colored terminal output for Python's logging module,,coloredlogs-15.0.1-pyhd8ed1ab_3,conda-forge,pyhd8ed1ab_3,3
future,0.18.3,MIT,https://github.com/PythonCharmers/python-future,Missing compatibility layer between Python 2 and Python 3,,future-0.18.3-pyhd8ed1ab_0,conda-forge,pyhd8ed1ab_0,0
gmp,6.3.0,GPL-2.0-or-later OR LGPL-3.0-or-later,https://github.com/ncw/gmp/blob/master/LICENSE,The GNU multiprecision library,,gmp-6.3.0-hf036a51_2,conda-forge,hf036a51_2,2
gmpy2,2.1.5,LGPL-3.0-or-later,https://github.com/aleaxit/gmpy/blob/master/COPYING.LESSER,GMP/MPIR, MPFR,gmpy2-2.1.5-py38hdb2c785_1,conda-forge,py38hdb2c785_1,1
humanfriendly,10.0,MIT,https://github.com/xolox/python-humanfriendly/blob/master/LICENSE.txt,Human friendly output for text interfaces using Python.,,humanfriendly-10.0-pyhd8ed1ab_6,conda-forge,pyhd8ed1ab_6,6
idna,3.7,BSD-3-Clause,https://github.com/kjd/idna,Internationalized Domain Names in Applications (IDNA),,idna-3.7-pyhd8ed1ab_0,conda-forge,pyhd8ed1ab_0,0
jmespath,0.10.0,MIT,https://github.com/jmespath/jmespath.py,Allows you to declaratively specify how to extract elements from a JSON document,,jmespath-0.10.0-pyh9f0ad1d_0,conda-forge,pyh9f0ad1d_0,0
joblib,1.4.2,BSD-3-Clause,https://github.com/joblib/joblib/blob/master/LICENSE.txt,Python function as pipeline jobs,,joblib-1.4.2-pyhd8ed1ab_0,conda-forge,pyhd8ed1ab_0,0
libabseil,20240116.2,Apache-2.0,https://github.com/abseil/abseil-cpp?tab=Apache-2.0-1-ov-file,The repository contains the Abseil C++ library code,,libabseil-20240116.2-cxx17_hf036a51_1,conda-forge,cxx17_hf036a51_1,1
libblas,3.9.0,BSD-3-Clause,http://www.netlib.org/blas/#_licensing,Linear Algebra PACKage,,libblas-3.9.0-20_osx64_openblas,conda-forge,20_osx64_openblas,20
libcblas,3.9.0,BSD-3-Clause,http://www.netlib.org/blas/#_licensing,Linear Algebra PACKage,,libcblas-3.9.0-20_osx64_openblas,conda-forge,20_osx64_openblas,20
libcxx,18.1.8,Apache-2.0 WITH LLVM-exception,https://llvm.org/docs/DeveloperPolicy.html#license,LLVM C++ standard library,,libcxx-18.1.8-hef8daea_0,conda-forge,hef8daea_0,0
libffi,3.4.2,MIT,https://github.com/libffi/libffi/blob/master/LICENSE,A Portable Foreign Function Interface Library,,libffi-3.4.2-h0d85af4_5,conda-forge,h0d85af4_5,5
libgfortran,5.0.0,GPL-3.0-only WITH GCC-exception-3.1,,,,libgfortran-5.0.0-13_2_0_h97931a8_3,conda-forge,13_2_0_h97931a8_3,3
libgfortran5,13.2.0,GPL-3.0-only WITH GCC-exception-3.1,http://www.gnu.org/licenses/gpl|https://www.gnu.org/licenses/gcc-exception-3.1.en.html,Fortran runtime library,,libgfortran5-13.2.0-h2873a65_3,conda-forge,h2873a65_3,3
liblapack,3.9.0,BSD-3-Clause,https://netlib.org/lapack/LICENSE.txt,Linear Algebra PACKage,,liblapack-3.9.0-20_osx64_openblas,conda-forge,20_osx64_openblas,20
libopenblas,0.3.25,BSD-3-Clause,https://github.com/xianyi/OpenBLAS/blob/develop/LICENSE,An optimized BLAS library based on GotoBLAS2 1.13 BSD version,,libopenblas-0.3.25-openmp_hfef2a42_0,conda-forge,openmp_hfef2a42_0,0
libprotobuf,4.25.3,BSD-3-Clause,https://github.com/protocolbuffers/protobuf/blob/main/LICENSE,Google's data interchange format. C++ Libraries and protoc the protobuf compiler,,libprotobuf-4.25.3-h4e4d658_0,conda-forge,h4e4d658_0,0
libzlib,1.3.1,Zlib,http://zlib.net/zlib_license.html,compression library dependency of python,,libzlib-1.3.1-h87427d6_1,conda-forge,h87427d6_1,1
llvm-openmp,18.1.8,Apache-2.0 WITH LLVM-exception,https://llvm.org/docs/DeveloperPolicy.html#license,LLVM openmp runtime,,llvm-openmp-18.1.8-h15ab845_0,conda-forge,h15ab845_0,0
mpc,1.3.1,LGPL-3.0-or-later,,https://github.com/aixoss/mpc?tab=LGPL-3.0-1-ov-file#readme,GNU C library for arithmetic of complex numbers with arbitrarily high precision and correct rounding,mpc-1.3.1-h81bd1dd_0,conda-forge,h81bd1dd_0,0
mpfr,4.2.1,LGPL-3.0-only,,https://github.com/BrianGladman/mpfr?tab=LGPL-3.0-1-ov-file#readme,a C library for multiple-precision floating-point computations with correct rounding,mpfr-4.2.1-h4f6b447_1,conda-forge,h4f6b447_1,1
mpmath,1.3.0,BSD-3-Clause,https://github.com/mpmath/mpmath/blob/master/LICENSE,A Python library for arbitrary-precision floating-point arithmetic,,mpmath-1.3.0-pyhd8ed1ab_0,conda-forge,pyhd8ed1ab_0,0
networkx,3.0,BSD-3-Clause,https://github.com/networkx/networkx/blob/master/LICENSE.txt,Python package for creating and manipulating complex networks,,networkx-3.0-pyhd8ed1ab_0,conda-forge,pyhd8ed1ab_0,0
numpy,1.23.0,BSD-3-Clause,https://github.com/numpy/numpy/blob/master/LICENSE.txt,The fundamental package for scientific computing with Python,,numpy-1.23.0-py38h604f2a5_0,conda-forge,py38h604f2a5_0,0
onnx,1.15.0,Apache-2.0,https://github.com/onnx/onnx/blob/main/LICENSE,Open Neural Network Exchange library,,onnx-1.15.0-py38h4ec5377_4,conda-forge,py38h4ec5377_4,4
onnxruntime,1.17.1,MIT AND BSL-1.0,https://github.com/microsoft/onnxruntime/blob/master/LICENSE,cross-platform high performance ML inferencing and training accelerator,,onnxruntime-1.17.1-py38h8edb6e6_2_cpu,conda-forge,py38h8edb6e6_2_cpu,2
openssl,3.3.1,Apache-2.0,https://github.com/openssl/openssl/blob/master/LICENSE.txt,ssl library,,openssl-3.3.1-h87427d6_2,conda-forge,h87427d6_2,2
packaging,24.1,Apache-2.0,https://github.com/pypa/packaging/blob/main/LICENSE|https://github.com/pypa/packaging/blob/main/LICENSE.APACHE|https://github.com/pypa/packaging/blob/main/LICENSE.BSD,Core utilities for Python packages,,packaging-24.1-pyhd8ed1ab_0,conda-forge,pyhd8ed1ab_0,0
pandas,1.1.5,BSD-3-Clause,https://github.com/pandas-dev/pandas/blob/master/LICENSE,data structures and data analysis tools,,pandas-1.1.5-py38hb2f4e1b_0,pkgs/main,py38hb2f4e1b_0,0
patsy,0.5.6,BSD-2-Clause AND PSF-2.0,https://github.com/pydata/patsy/blob/master/LICENSE.txt,library for describing statistical models and building design matrices,,patsy-0.5.6-pyhd8ed1ab_0,conda-forge,pyhd8ed1ab_0,0
platformdirs,4.2.2,MIT,https://github.com/platformdirs/platformdirs,Will help you choose an appropriate directory structure,,platformdirs-4.2.2-pyhd8ed1ab_0,conda-forge,pyhd8ed1ab_0,0
pooch,1.8.2,BSD-3-Clause,https://github.com/fatiando/pooch,a Python library that can manage data by downloading files from a server (only when needed) and storing them locally in a data cache,,pooch-1.8.2-pyhd8ed1ab_0,conda-forge,pyhd8ed1ab_0,0
protobuf,4.25.3,BSD-3-Clause,https://github.com/protocolbuffers/protobuf/blob/main/LICENSE,Google's data interchange format,,protobuf-4.25.3-py38hba9f9f8_0,conda-forge,py38hba9f9f8_0,0
psutil,5.8.0,BSD-3-Clause,https://github.com/giampaolo/psutil/blob/master/LICENSE,process manipuation,,psutil-5.8.0-py38h96a0964_2,conda-forge,py38h96a0964_2,2
python,3.8.19,Python-2.0,https://docs.python.org/3/license.html,python runtime,,python-3.8.19-h5ba8234_0_cpython,conda-forge,h5ba8234_0_cpython,0
python-dateutil,2.9.0,Apache-2.0,https://github.com/dateutil/dateutil/blob/master/LICENSE,Extensions to the standard Python datetime module,,python-dateutil-2.9.0-pyhd8ed1ab_0,conda-forge,pyhd8ed1ab_0,0
python-flatbuffers,24.3.25,Apache-2.0,https://github.com/google/flatbuffers/blob/master/LICENSE.txt,library for use with the Flatbuffers serialization format,,python-flatbuffers-24.3.25-pyh59ac667_0,conda-forge,pyh59ac667_0,0
python_abi,3.8,BSD-3-Clause,https://github.com/conda-forge/python_abi-feedstock/blob/main/LICENSE.txt,Meta package to select python implementation,,python_abi-3.8-4_cp38,conda-forge,4_cp38,4
pytz,2024.1,MIT,https://github.com/newvem/pytz/blob/master/LICENSE.txt,dependency,,pytz-2024.1-pyhd8ed1ab_0,conda-forge,pyhd8ed1ab_0,0
requests,2.32.3,Apache-2.0,https://github.com/psf/requests/blob/main/LICENSE,HTTP Library for Python,,requests-2.32.3-pyhd8ed1ab_0,conda-forge,pyhd8ed1ab_0,0
ruptures,1.1.9,BSD-2-Clause,https://github.com/deepcharles/ruptures,Python library for off-line change point detection,,ruptures-1.1.9-py38h63504b1_1,conda-forge,py38h63504b1_1,1
s3transfer,0.3.7,Apache-2.0,https://github.com/boto/s3transfer,An Amazon S3 transfer manager,,s3transfer-0.3.7-pyhd8ed1ab_0,conda-forge,pyhd8ed1ab_0,0
scikit-learn,0.24.2,BSD-3-Clause,https://github.com/scikit-learn/scikit-learn/blob/master/COPYING,machine learning library,,scikit-learn-0.24.2-py38h1021539_1,conda-forge,py38h1021539_1,1
scipy,1.10.0,BSD-3-Clause,https://github.com/scipy/scipy/blob/master/LICENSE.txt,math libraries and data science tools,,scipy-1.10.0-py38hfb8b963_2,conda-forge,py38hfb8b963_2,2
setuptools,70.0.0,MIT,https://github.com/pypa/setuptools/blob/master/LICENSE,dependency of python,,setuptools-70.0.0-pyhd8ed1ab_0,conda-forge,pyhd8ed1ab_0,0
six,1.16.0,MIT,https://github.com/benjaminp/six/blob/master/LICENSE,backwards compatibility utility package,,six-1.16.0-pyh6c4a22f_0,conda-forge,pyh6c4a22f_0,0
statsmodels,0.13.2,BSD-3-Clause,https://github.com/statsmodels/statsmodels/blob/master/LICENSE.txt,statistics and math library package,,statsmodels-0.13.2-py38hc1426ef_0,conda-forge,py38hc1426ef_0,0
sympy,1.13.0,BSD-3-Clause,https://github.com/sympy/sympy/blob/master/LICENSE,Python Library for Symbolic Mathematics,,sympy-1.13.0-pypyh2585a3b_103,conda-forge,pypyh2585a3b_103,103
threadpoolctl,3.5.0,BSD-3-Clause,https://github.com/joblib/threadpoolctl/blob/master/LICENSE,Python helpers to control the threadpools of native libraries,,threadpoolctl-3.5.0-pyhc1e730c_0,conda-forge,pyhc1e730c_0,0
typing-extensions,4.12.2,PSF-2.0,https://github.com/python/typing/blob/master/typing_extensions/LICENSE,type hinting library for python,,typing-extensions-4.12.2-hd8ed1ab_0,conda-forge,hd8ed1ab_0,0
typing_extensions,4.12.2,PSF-2.0,https://github.com/python/typing/blob/master/typing_extensions/LICENSE,Type Hints for Python,,typing_extensions-4.12.2-pyha770c72_0,conda-forge,pyha770c72_0,0
urllib3,1.26.19,MIT,https://github.com/urllib3/urllib3/blob/main/LICENSE.txt,HTTP library with thread-safe connection pooling file postgit status and more,,urllib3-1.26.19-pyhd8ed1ab_0,conda-forge,pyhd8ed1ab_0,0
wheel,0.43.0,MIT,https://github.com/pypa/wheel/blob/master/LICENSE.txt,package distribution,,wheel-0.43.0-pyhd8ed1ab_1,conda-forge,pyhd8ed1ab_1,1
xz,5.2.6,LGPL-2.1 and GPL-2.0,https://git.tukaani.org/?p=xz.git;a=blob_plain;f=COPYING;hb=HEAD,Data compression software with high compression ratio,,xz-5.2.6-h775f41a_0,conda-forge,h775f41a_0,0
